field_name,form_name,section_header,field_type,field_label,select_choices_or_calculations,field_note,text_validation_type_or_show_slider_number,text_validation_min,text_validation_max,identifier,branching_logic,required_field,custom_alignment,question_number,matrix_group_name,matrix_ranking,field_annotation
cantaffordcare_tooklessmedtosavemoney,healthcare_access_and_utilization,,radio,"You took less medicine to save money","TookLessMedToSaveMoney_Yes, Yes | TookLessMedToSaveMoney_No, No | PMI_Dontknow, Don't know","Start Date: 5/31/2018 EXCEPT PMI_Dontknow: 5/30/2017",,,,,,,LV,,,,
cantaffordcare_delayedfillingrxtosavemoney,healthcare_access_and_utilization,,radio,"You delayed filling a prescription to save money","DelayedFillingRxToSaveMoney_Yes, Yes | DelayedFillingRxToSaveMoney_No, No | PMI_Dontknow, Don't know","Start Date: 5/31/2018 EXCEPT PMI_Dontknow: 5/30/2017",,,,,,,LV,,,,
cantaffordcare_lowercostrxtosavemoney,healthcare_access_and_utilization,,radio,"You asked your doctor for a lower cost medication to save money","LowerCostRxToSaveMoney_Yes, Yes | LowerCostRxToSaveMoney_No, No | PMI_Dontknow, Don't know","Start Date: 5/31/2018 EXCEPT PMI_Dontknow: 5/30/2017",,,,,,,LV,,,,
cantaffordcare_boughtrxfromothercountry,healthcare_access_and_utilization,,radio,"You bought prescription drugs from another country to save money","BoughtRxFromOtherCountry_Yes, Yes | BoughtRxFromOtherCountry_No, No | PMI_Dontknow, Don't know","Start Date: 5/31/2018 EXCEPT PMI_Dontknow: 5/30/2017",,,,,,,LV,,,,
cantaffordcare_alternativetherapies,healthcare_access_and_utilization,,radio,"You used alternative therapies to save money","AlternativeTherapies_Yes, Yes | AlternativeTherapies_No, No | PMI_Dontknow, Don't know","Start Date: 5/31/2018 EXCEPT PMI_Dontknow: 5/30/2017",,,,,,,LV,,,,
healthproviderracereligion_howimportant,healthcare_access_and_utilization,"The following questions are about your experiences with doctors and other health care providers in the past year. Some people think it is helpful if their providers are from the same background that they are - like in terms of race or religion or native language - because they think their doctors will better understand what they're experiencing or going through.",radio,"How important is it to you that your doctors or health care providers understand or are similar to you in any of these ways? Would you say...","HowImportant_VeryImportant, Very important | HowImportant_SomewhatImportant, Somewhat important | HowImportant_SlightlyImportant, Slightly important | HowImportant_NotImportant, Not important at all | PMI_Dontknow, Don't know","Start Date: 5/31/2018 EXCEPT PMI_Dontknow: 5/30/2017",,,,,,,LV,,,,
healthproviderracereligion_howoften,healthcare_access_and_utilization,,radio,"How often were you able to see doctors or health care providers who were similar to you in any of these ways? Would you say...","HowOften_Always, Always | HowOften_MostOfTheTime, Most of the time | HowOften_SomeOfTheTime, Some of the time | HowOften_NoneOfTheTime, None of the time | PMI_Dontknow, Don't know","Start Date: 5/31/2018 EXCEPT PMI_Dontknow: 5/30/2017",,,,,,,LV,,,,
healthproviderracereligion_delayedornocare,healthcare_access_and_utilization,,radio,"How often have you either delayed or not gone to see doctors or health care providers because they were different from you in any of these ways?","DelayedOrNoCare_Always, Always | DelayedOrNoCare_MostOfTheTime, Most of the time | DelayedOrNoCare_SomeOfTheTime, Some of the time | DelayedOrNoCare_NoneOfTheTime, None of the time | PMI_Dontknow, Don't know","Start Date: 5/31/2018 EXCEPT PMI_Dontknow: 5/30/2017",,,,,,,LV,,,,
hc_thankyou,healthcare_access_and_utilization,,descriptive,"Thank you for completing the Health Care Access and Utilization survey. The information you have shared may contribute to helping researchers improve the health of generations to come.",,,,,,,,,LV,,,,
